{
  "profileId": "engine.default",
  "schemaVersion": 1,
  "version": "2026.10.1",
  "status": "DRAFT_UNVERIFIED",
  "effectiveFrom": "0001-01-01",
  "effectiveTo": null,
  "scope": {
    "countries": [
      "*"
    ],
    "adminAreas": [],
    "polygonsRef": null
  },
  "authority": {
    "name": "Engine default (no local authority profile)",
    "type": "ENGINE_DEFAULT"
  },
  "referenceMode": "EXACT_COORDINATE",
  "referencePoints": [],
  "rules": {
    "imsak": null,
    "fajr": {
      "type": "solarAltitude",
      "degrees": 18
    },
    "sunrise": {
      "type": "horizon"
    },
    "dhuhr": {
      "type": "transit"
    },
    "asr": {
      "type": "shadowFactor",
      "k": 1
    },
    "maghrib": {
      "type": "horizon"
    },
    "isha": {
      "type": "solarAltitude",
      "degrees": 18
    }
  },
  "horizon": {
    "elevationPolicy": "NONE"
  },
  "highLatitude": {
    "chain": [
      "anglePortion",
      {
        "nearestLatitude": {
          "latDeg": 48.5
        }
      }
    ]
  },
  "rounding": {
    "default": "ceil",
    "sunrise": "floor"
  },
  "adjustments": {
    "perEventMinutes": {},
    "maxAbsMinutes": 0,
    "ramadan": {}
  },
  "evidence": {
    "sources": [],
    "benchmarkSet": "engine-default",
    "holdoutReport": null,
    "benchmarkReportId": null
  },
  "approvals": {
    "religious": null,
    "accuracy": null
  },
  "compatibility": {
    "minEngineSchema": 1,
    "minAppVersion": "1.0.0"
  }
}
