[{"adjustments":{"maxAbsMinutes":3,"perEventMinutes":{"dhuhr":2,"fajr":-1,"isha":-1,"maghrib":2,"sunrise":-3},"ramadan":{}},"approvals":{"accuracy":null,"religious":null},"authority":{"name":"General Authority of Islamic Affairs and Endowments convention","type":"GOVERNMENT"},"compatibility":{"minAppVersion":"1.0.0","minEngineSchema":1},"effectiveFrom":"2026-10-01","effectiveTo":null,"evidence":{"benchmarkReportId":null,"benchmarkSet":"ae-2026-q4","holdoutReport":null,"sources":[{"retrievedOn":"2026-10-29","sha256":"2cf979fc133d37226a7f9fac5143d63d697f2b83dabc1e6a49978c74ff041c30","title":"Awqaf prayer times, Abu Dhabi (Musaffah), monthly tables Jan/Apr/Jul/Oct 2026","url":"https://www.awqaf.gov.ae/prayer-times"}]},"highLatitude":{"chain":["anglePortion",{"nearestLatitude":{"latDeg":48.5}}]},"horizon":{"elevationPolicy":"NONE"},"profileId":"ae.awqaf.standard","referenceMode":"EXACT_COORDINATE","referencePoints":[],"rounding":{"default":"ceil","sunrise":"floor"},"rules":{"asr":{"k":1,"type":"shadowFactor"},"dhuhr":{"type":"transit"},"fajr":{"degrees":18.1,"type":"solarAltitude"},"imsak":null,"isha":{"degrees":18.2,"type":"solarAltitude"},"maghrib":{"refractionArcmin":40,"type":"horizon"},"sunrise":{"type":"horizon"}},"schemaVersion":1,"scope":{"adminAreas":[],"countries":["AE"],"polygonsRef":null},"status":"DRAFT_UNVERIFIED","version":"2026.10.1"},{"adjustments":{"maxAbsMinutes":0,"perEventMinutes":{},"ramadan":{}},"approvals":{"accuracy":null,"religious":null},"authority":{"name":"Umm al-Qura convention (interim for Bahrain)","type":"COMMUNITY_CONVENTION"},"compatibility":{"minAppVersion":"1.0.0","minEngineSchema":1},"effectiveFrom":"2026-10-01","effectiveTo":null,"evidence":{"benchmarkReportId":null,"benchmarkSet":"bh-2026-q4","holdoutReport":null,"sources":[]},"highLatitude":{"chain":["anglePortion",{"nearestLatitude":{"latDeg":48.5}}]},"horizon":{"elevationPolicy":"NONE"},"profileId":"bh.ummalqura.interim","referenceMode":"EXACT_COORDINATE","referencePoints":[],"rounding":{"default":"ceil","sunrise":"floor"},"rules":{"asr":{"k":1,"type":"shadowFactor"},"dhuhr":{"type":"transit"},"fajr":{"degrees":18.5,"type":"solarAltitude"},"imsak":null,"isha":{"base":"maghrib","minutes":90,"type":"intervalAfter"},"maghrib":{"type":"horizon"},"sunrise":{"type":"horizon"}},"schemaVersion":1,"scope":{"adminAreas":[],"countries":["BH"],"polygonsRef":null},"status":"DRAFT_UNVERIFIED","version":"2026.10.1"},{"adjustments":{"maxAbsMinutes":3,"perEventMinutes":{},"ramadan":{}},"approvals":{"accuracy":null,"religious":null},"authority":{"name":"Egyptian General Authority of Survey convention","type":"GOVERNMENT"},"compatibility":{"minAppVersion":"1.0.0","minEngineSchema":1},"effectiveFrom":"2026-10-01","effectiveTo":null,"evidence":{"benchmarkReportId":null,"benchmarkSet":"eg-2026-q4","holdoutReport":null,"sources":[]},"highLatitude":{"chain":["anglePortion",{"nearestLatitude":{"latDeg":48.5}}]},"horizon":{"elevationPolicy":"NONE"},"profileId":"eg.egas.standard","referenceMode":"EXACT_COORDINATE","referencePoints":[],"rounding":{"default":"ceil","sunrise":"floor"},"rules":{"asr":{"k":1,"type":"shadowFactor"},"dhuhr":{"offsetMinutes":0,"type":"transit"},"fajr":{"degrees":19.5,"type":"solarAltitude"},"imsak":null,"isha":{"degrees":17.5,"type":"solarAltitude"},"maghrib":{"type":"horizon"},"sunrise":{"type":"horizon"}},"schemaVersion":1,"scope":{"adminAreas":[],"countries":["EG"],"polygonsRef":null},"status":"DRAFT_UNVERIFIED","version":"2026.10.1"},{"adjustments":{"maxAbsMinutes":0,"perEventMinutes":{},"ramadan":{}},"approvals":{"accuracy":null,"religious":null},"authority":{"name":"Engine default (no local authority profile)","type":"ENGINE_DEFAULT"},"compatibility":{"minAppVersion":"1.0.0","minEngineSchema":1},"effectiveFrom":"0001-01-01","effectiveTo":null,"evidence":{"benchmarkReportId":null,"benchmarkSet":"engine-default","holdoutReport":null,"sources":[]},"highLatitude":{"chain":["anglePortion",{"nearestLatitude":{"latDeg":48.5}}]},"horizon":{"elevationPolicy":"NONE"},"profileId":"engine.default","referenceMode":"EXACT_COORDINATE","referencePoints":[],"rounding":{"default":"ceil","sunrise":"floor"},"rules":{"asr":{"k":1,"type":"shadowFactor"},"dhuhr":{"type":"transit"},"fajr":{"degrees":18,"type":"solarAltitude"},"imsak":null,"isha":{"degrees":18,"type":"solarAltitude"},"maghrib":{"type":"horizon"},"sunrise":{"type":"horizon"}},"schemaVersion":1,"scope":{"adminAreas":[],"countries":["*"],"polygonsRef":null},"status":"DRAFT_UNVERIFIED","version":"2026.10.1"},{"adjustments":{"maxAbsMinutes":0,"perEventMinutes":{},"ramadan":{"isha":{"base":"maghrib","minutes":120,"type":"intervalAfter"}}},"approvals":{"accuracy":null,"religious":null},"authority":{"name":"Umm al-Qura convention","type":"GOVERNMENT"},"compatibility":{"minAppVersion":"1.0.0","minEngineSchema":1},"effectiveFrom":"2026-10-01","effectiveTo":null,"evidence":{"benchmarkReportId":null,"benchmarkSet":"sa-2026-q4","holdoutReport":null,"sources":[]},"highLatitude":{"chain":["anglePortion",{"nearestLatitude":{"latDeg":48.5}}]},"horizon":{"elevationPolicy":"NONE"},"profileId":"sa.ummalqura.standard","referenceMode":"EXACT_COORDINATE","referencePoints":[],"rounding":{"default":"ceil","sunrise":"floor"},"rules":{"asr":{"k":1,"type":"shadowFactor"},"dhuhr":{"type":"transit"},"fajr":{"degrees":18,"type":"solarAltitude"},"imsak":null,"isha":{"base":"maghrib","minutes":90,"type":"intervalAfter"},"maghrib":{"type":"horizon"},"sunrise":{"type":"horizon"}},"schemaVersion":1,"scope":{"adminAreas":[],"countries":["SA"],"polygonsRef":null},"status":"DRAFT_UNVERIFIED","version":"2026.10.1"}]